"ID","Authors","Year","Title","Journal","DOI","Process_Phase","Mechanism","Study_Type","Region","Parameters","Time_Scale","Key_Findings","Relevance"
"1","Keefer DK","1984","Landslides caused by earthquakes","Geological Society of America Bulletin","10.1130/0016-7606(1984)95<406:LCBE>2.0.CO;2","initial_aggradation","coseismic_landslide","review","Global (40 earthquakes)","landslide area; earthquake magnitude; slope angle; lithology","decades","Established magnitude thresholds for earthquake-triggered landslides: M4 for rock falls, M5 for disrupted slides, M6 for coherent slides; catalogued 40 historical earthquakes showing landslide distances scale with magnitude up to 500 km for M9.2","high"
"2","Keefer DK","1994","The importance of earthquake-induced landslides to long-term slope erosion and slope-failure hazards in seismically active regions","Geomorphology","10.1016/0169-555X(94)90021-3","multiple","coseismic_landslide","review","Global (seismically active regions)","landslide erosion rate; recurrence interval; sediment volume","century","Coseismic landslides contribute 2-58% of total long-term hillslope erosion in seismically active regions; earthquake-induced erosion is episodic but cumulatively dominant in areas with recurrence intervals shorter than ~1000 years","high"
"3","Dadson SJ, Hovius N, Chen H et al.","2003","Links between erosion, runoff variability and seismicity in the Taiwan orogen","Nature","10.1038/nature02150","multiple","multiple","field_observation","Taiwan","suspended sediment concentration; runoff; seismicity rate; denudation rate","decades","Mean erosion rate across Taiwan is 3.9-6.0 mm/yr with spatial variation controlled by runoff variability and seismicity; earthquake-prone regions show 2-3x higher erosion than aseismic areas with similar precipitation","high"
"4","Dadson SJ, Hovius N, Chen H et al.","2004","Earthquake-triggered increase in sediment delivery from an active mountain belt","Geology","10.1130/G20639.1","initial_aggradation","coseismic_landslide","combined","Taiwan","suspended sediment load; landslide inventory; river discharge","years","The 1999 Chi-Chi earthquake triggered >20000 landslides that increased catchment-scale sediment concentrations by a factor of 5.3 during subsequent typhoon Toraji; suspended sediment yields remained elevated for at least 4 years post-earthquake","high"
"5","Korup O, McSaveney MJ, Davies TRH","2004","Sediment generation and delivery from large historic landslides in the Southern Alps, New Zealand","Geomorphology","10.1016/j.geomorph.2004.01.001","remobilization","hillslope_connectivity","field_observation","Southern Alps, New Zealand","landslide volume; sediment delivery ratio; channel aggradation depth","decades","Large rock avalanches in the Southern Alps deliver only 1-10% of their volume to the fluvial network within decades; most debris remains stored on hillslopes or as valley fills acting as long-term sediment capacitors","high"
"6","Korup O, Strom AL, Weidinger JT","2006","Fluvial response to large rock-slope failures: Examples from the Himalayas, the Tien Shan, and the Southern Alps in New Zealand","Geomorphology","10.1016/j.geomorph.2005.07.001","geomorphic_adjustment","multiple","field_observation","Himalayas; Tien Shan; Southern Alps, New Zealand","channel gradient; dam lake volume; knickpoint retreat rate; aggradation depth","century","Rivers upstream of large rock avalanche dams aggrade by 10-100 m while downstream channels incise; knickpoints generated by dam breaching propagate upstream at rates of 0.1-1 km/yr creating persistent geomorphic signatures lasting centuries","high"
"7","Koi T, Hotta N, Ishigaki I et al.","2008","Prolonged impact of earthquake-induced landslides on sediment yield in a mountain watershed: The Tanzawa region, Japan","Geomorphology","10.1016/j.geomorph.2008.03.007","remobilization","coseismic_landslide","field_observation","Tanzawa, Japan","sediment yield; landslide area; rainfall intensity; recovery time","decades","Sediment yield remained elevated for >30 years following the 1923 Kanto earthquake (M7.9) in Tanzawa watersheds; recovery half-life was approximately 10 years with complete return to background rates requiring several decades","high"
"8","Chuang SC, Chen H, Lin GW et al.","2009","Increase in basin sediment yield from landslides in storms following major seismic disturbance","Engineering Geology","10.1016/j.enggeo.2008.08.001","remobilization","hydrometeorological","field_observation","Taiwan","basin sediment yield; storm rainfall; landslide density; turbidity","years","Post-Chi-Chi typhoon-driven sediment yields increased 4-8 fold compared to pre-earthquake storms of similar magnitude; the sediment mobilization efficiency per unit rainfall was persistently elevated indicating earthquake preconditioning of hillslopes","high"
"9","Chen CY","2009","Sedimentary impacts from landslides in the Tachia River Basin, Taiwan","Geomorphology","10.1016/j.geomorph.2008.10.009","initial_aggradation","coseismic_landslide","field_observation","Tachia River Basin, Taiwan","channel cross-section change; landslide dam volume; reservoir sedimentation rate","years","Chi-Chi earthquake-triggered landslides deposited ~100 million m3 of sediment in the Tachia River system; Techi Reservoir sedimentation rate increased by a factor of 3 post-earthquake with coarse debris pulses propagating 5-15 km downstream","medium"
"10","Yanites BJ, Tucker GE, Mueller KJ, Chen Y","2010","How rivers react to large earthquakes: evidence from central Taiwan","Geology","10.1130/G30883.1","geomorphic_adjustment","channel_incision","field_observation","Central Taiwan","channel width; incision rate; bedrock exposure; sediment cover thickness","years","Rivers in the Chi-Chi earthquake hanging wall showed initial 2-4 m aggradation followed by rapid incision exceeding pre-earthquake rates within 5 years; channel narrowing of 20-40% accompanied incision as rivers adjusted to excess sediment supply","high"
"11","Korup O, Densmore AL, Schlunegger F","2010","The role of landslides in mountain range evolution","Geomorphology","10.1016/j.geomorph.2010.02.021","multiple","coseismic_landslide","review","Global mountain ranges","landslide volume-frequency; orogen sediment budget; relief evolution","century","Large earthquake-triggered landslides can reset topographic relief by tens of meters in a single event; over millennial timescales they dominate the erosion budget of active orogens contributing 50-80% of total denudation in ranges like the Southern Alps and Himalayas","medium"
"12","Hovius N, Meunier P, Lin CW et al.","2011","Prolonged seismically induced erosion and the mass balance of a large earthquake","Earth and Planetary Science Letters","10.1016/j.epsl.2011.02.005","recovery","multiple","combined","Taiwan","mass wasting rate; landslide inventory; Choshui River sediment load; recovery time","years","Post-Chi-Chi mass wasting peaked at >5x background rates and returned to pre-earthquake levels in ~6 years; the Choshui River removed >30% of coseismically added rock mass during that period driven by typhoon-triggered remobilization","high"
"13","Parker RN, Densmore AL, Rosser NJ et al.","2011","Mass wasting triggered by the 2008 Wenchuan earthquake is greater than orogenic growth","Nature Geoscience","10.1038/ngeo1154","initial_aggradation","coseismic_landslide","combined","Longmen Shan, China","landslide volume; coseismic uplift volume; erosion-uplift mass balance","years","Total volume of landslides triggered by the 2008 Wenchuan earthquake (2.8 +/- 0.9 km3) exceeded the rock volume added by coseismic uplift by a factor of 4-9; single large earthquakes can thus cause net topographic lowering of the orogen","high"
"14","Shou KJ, Wu CC, Fei LY et al.","2011","Dynamic environment in the Ta-Chia River watershed after the 1999 Taiwan Chi-Chi earthquake","Geomorphology","10.1016/j.geomorph.2011.02.025","geomorphic_adjustment","multiple","field_observation","Ta-Chia River, Taiwan","channel bed elevation; riverbank erosion rate; landslide dam evolution; debris flow frequency","years","The Jiufenershan landslide dam in Ta-Chia River created a 4 km backwater zone and 20 m channel bed rise; dam breaching generated a 10 m incision wave propagating downstream at ~1 km/yr with persistent channel instability a decade later","medium"
"15","Steer P, Simoes M, Cattin R, Shyu JBH","2014","Erosion influences the seismicity of active thrust faults","Nature Communications","10.1038/ncomms6564","recovery","multiple","modeling","Taiwan","erosion rate; Coulomb stress change; seismicity rate; fault loading","decades","Typhoon Morakot-scale erosion events (~1 km3 removed in days) unload faults sufficiently to alter Coulomb stress by 0.1-1 MPa and modulate shallow seismicity rates; erosion-seismicity coupling creates a negative feedback on earthquake-driven topography","medium"
"16","Huang RQ, Li WL","2014","Post-earthquake landsliding and long-term impacts in the Wenchuan earthquake area, China","Engineering Geology","10.1016/j.enggeo.2014.07.008","remobilization","debris_flow","field_observation","Wenchuan, China","post-seismic landslide count; debris flow frequency; rainfall threshold","years","Post-seismic landslide activity in Wenchuan increased 5-10 fold over 5 years with rainfall triggering thresholds reduced by 30-50% compared to pre-earthquake conditions; debris flows occurred at rainfall intensities as low as 10 mm/hr due to abundant loose material","high"
"17","Marc O, Hovius N, Meunier P","2015","Transient changes of landslide rates after earthquakes","Geology","10.1130/G36961.1","remobilization","coseismic_landslide","remote_sensing","Chi-Chi Taiwan; Wenchuan China; Northridge USA","landslide rate; recovery time; landslide size distribution; earthquake magnitude","years","Post-seismic landslide rates decay exponentially with characteristic times of 1-4 years depending on earthquake magnitude and climate; recovery time scales with earthquake magnitude and is shortened by intense monsoon precipitation that rapidly evacuates unstable material","high"
"18","Liu F, Yang S","2015","The effect of the Wenchuan earthquake on the fluvial morphology in the Longmen Shan, eastern Tibetan Plateau","Quaternary International","10.1016/j.quaint.2014.09.075","geomorphic_adjustment","channel_incision","field_observation","Longmen Shan, China","channel width; knickpoint location; bed grain size; longitudinal profile","years","Rivers in the Wenchuan rupture zone showed 50-200% channel widening and bed coarsening within 3 years; knickpoints formed at tributary junctions where landslide debris created local base-level rises of 5-15 m","medium"
"19","Wang J, Jin Z, Hilton RG et al.","2015","Controls on fluvial evacuation of sediment from earthquake-triggered landslides","Geology","10.1130/G36157.1","remobilization","hillslope_connectivity","combined","Wenchuan, China","suspended sediment load; landslide connectivity index; catchment area; discharge","years","Only 38% of Wenchuan landslides directly connect to the fluvial network; connected landslides dominate the post-seismic sediment flux contributing >80% of elevated suspended loads while disconnected deposits remain as hillslope storage for decades","high"
"20","Marc O, Hovius N, Meunier P, Gorum T, Uchida T","2016","A seismologically consistent expression for the total area and volume of earthquake-triggered landsliding","Journal of Geophysical Research: Earth Surface","10.1002/2015JF003732","initial_aggradation","coseismic_landslide","combined","Global (multiple earthquake events)","total landslide area; total landslide volume; seismic moment; PGA","years","Total landslide volume scales as a power law with seismic moment (exponent ~0.67) providing the first physics-based prediction of coseismic sediment generation; landslide area saturates for very large earthquakes as available slopes become exhausted","high"
"21","Marc O, Hovius N, Meunier P","2016","The mass balance of earthquakes and earthquake sequences","Geophysical Research Letters","10.1002/2016GL068333","initial_aggradation","coseismic_landslide","combined","Global (seismic orogens)","coseismic uplift volume; landslide volume; net mass change; earthquake magnitude","decades","Net coseismic mass balance transitions from positive (uplift > erosion) below Mw ~7.5 to negative above; shallow thrust earthquakes in steep terrain produce the most disproportionate erosion creating a seismic topographic ceiling","high"
"22","Li GK, West AJ, Densmore AL et al.","2016","Connectivity of earthquake-triggered landslides with the fluvial network: Implications for landslide sediment transport after the 2008 Wenchuan earthquake","Journal of Geophysical Research: Earth Surface","10.1002/2015JF003718","remobilization","hillslope_connectivity","remote_sensing","Wenchuan, China","landslide-channel connectivity; sediment delivery ratio; channel distance; slope gradient","years","Landslide connectivity to channels in Wenchuan is controlled by hillslope gradient and distance to channel: 85% of landslides within 100 m of channels are connected versus <20% beyond 500 m; connectivity determines whether sediment evacuates in years or persists for decades","high"
"23","Robinson TR, Davies TRH, Wilson TM, Orchiston C","2016","Coseismic landsliding estimates for an Alpine Fault earthquake and the consequences for erosion of the Southern Alps, New Zealand","Geomorphology","10.1016/j.geomorph.2016.03.033","initial_aggradation","coseismic_landslide","modeling","Southern Alps, New Zealand","predicted landslide volume; river aggradation depth; sediment delivery; dam formation probability","decades","An Mw8 Alpine Fault earthquake would trigger 50000-100000 landslides generating 1-3 km3 of debris; rivers would aggrade 5-20 m across the western Southern Alps with complete sediment evacuation requiring 50-100 years","high"
"24","Croissant T, Lague D, Steer P, Davy P","2017","Rapid post-seismic landslide evacuation boosted by dynamic river width","Nature Geoscience","10.1038/ngeo3005","remobilization","multiple","modeling","Synthetic Alpine catchments","river width; sediment transport capacity; evacuation time; aggradation thickness","decades","Dynamic river widening in response to sediment overloading increases transport capacity by 3-10x compared to fixed-width models; this mechanism reduces post-seismic sediment evacuation timescales from centuries to decades explaining observed rapid geomorphic recovery","high"
"25","Wang W, Godard V, Liu-Zeng J et al.","2017","Perturbation of fluvial sediment fluxes following the 2008 Wenchuan earthquake","Earth Surface Processes and Landforms","10.1002/esp.4210","remobilization","hydrometeorological","field_observation","Wenchuan, China","suspended sediment flux; 10Be concentration; rainfall-sediment relationship","years","Post-Wenchuan sediment fluxes show a 3-5 fold increase that is not proportional across grain sizes; 10Be dilution by shallow landslide material indicates the excess sediment is predominantly from coseismic deposits rather than new deep-seated failures","high"
"26","Fan XM, Domènech G, Scaringi G et al.","2018","Spatio-temporal evolution of mass wasting after the 2008 Mw 7.9 Wenchuan earthquake revealed by a detailed multi-temporal inventory","Landslides","10.1007/s10346-018-1054-5","remobilization","coseismic_landslide","remote_sensing","Wenchuan, China","landslide count; area change; NDVI recovery; temporal frequency","years","Post-seismic landslide activity in Wenchuan peaked in 2008-2010 then declined with NDVI-based vegetation recovery reaching 60% within 5 years; however spatially heterogeneous patterns showed persistent hotspots along fault-adjacent valleys where shattered rock continued failing","high"
"27","Fan XM, Juang CH, Wasowski J et al.","2018","What we have learned from the 2008 Wenchuan Earthquake and its aftermath: A decade of research and challenges","Engineering Geology","10.1016/j.enggeo.2018.09.015","multiple","multiple","review","Wenchuan, China","landslide inventory completeness; hazard chain documentation; monitoring technology evolution","decades","A decade of Wenchuan research revealed that earthquake hazard chains (landslide-debris flow-river damming-outburst flood) persist far longer than expected; post-seismic debris flows increased in frequency but decreased in magnitude over 10 years as the available loose material was gradually exhausted","high"
"28","Dingle EH, Sinclair HD, Attal M et al.","2018","Temporal variability in detrital 10Be concentrations in a large Himalayan catchment","Earth Surface Dynamics","10.5194/esurf-6-611-2018","remobilization","hydrometeorological","field_observation","Marsyandi River, Nepal","10Be concentration; grain size; monsoon discharge; sediment provenance","years","Detrital 10Be in the Marsyandi varies by a factor of 5 between monsoon and dry seasons due to mixing of deeply eroded landslide material with shallow soil; this temporal variability means single 10Be samples can misestimate millennial erosion rates by 2-3x in seismically active catchments","medium"
"29","Croissant T, Steer P, Lague D et al.","2019","Seismic cycles, earthquakes, landslides and sediment fluxes: Linking tectonics to surface processes using a reduced-complexity model","Geomorphology","10.1016/j.geomorph.2019.04.017","multiple","multiple","modeling","Alpine Fault, New Zealand (synthetic)","seismic cycle period; landslide volume; sediment flux; fluvial evacuation time","century","Post-seismic sediment flux is connectivity-limited in steep catchments (evacuation < seismic cycle) but transport-limited in gentle catchments (evacuation > seismic cycle); this dichotomy controls whether landscapes reach steady-state between earthquakes or accumulate a sediment deficit","high"
"30","Fan XM, Scaringi G, Korup O et al.","2019","Earthquake-Induced Chains of Geologic Hazards: Patterns, Mechanisms, and Impacts","Reviews of Geophysics","10.1029/2018RG000626","multiple","multiple","review","Global (earthquake-affected regions)","hazard chain typology; cascade probability; temporal evolution; impact assessment","decades","Earthquake hazard chains follow a characteristic temporal cascade: coseismic landslides (seconds) to debris flows (days-years) to river aggradation (years-decades) to flood risk amplification (decades); each stage has distinct triggering thresholds that evolve as the landscape heals","high"
"31","Li G, Densmore AL, West AJ","2019","Competing Effects of Mountain Uplift and Landslide Erosion Over Earthquake Cycles","Journal of Geophysical Research: Solid Earth","10.1029/2018JB016986","multiple","coseismic_landslide","modeling","Generic thrust fault orogen","uplift-erosion ratio; mean topography; seismic cycle duration; landslide volume scaling","century","Modeled orogen topography oscillates over seismic cycles with coseismic erosion lowering peaks by 5-50 m per event; steady-state mountain height is set by the competition between interseismic uplift rate and the coseismic erosion efficiency which itself depends on rock strength and slope gradient","medium"
"32","Marc O, Behling R, Andermann C et al.","2019","Long-term erosion of the Nepal Himalayas by bedrock landsliding: the role of monsoons, earthquakes and giant landslides","Earth Surface Dynamics","10.5194/esurf-7-107-2019","multiple","coseismic_landslide","remote_sensing","Nepal Himalayas","landslide area-frequency; erosion rate; monsoon triggering; giant landslide contribution","decades","Giant landslides (>1 km2) contribute 30-50% of total landslide erosion volume in Nepal despite being <1% of all events; earthquake triggering shifts the landslide size distribution toward larger failures increasing the geomorphic impact per event by an order of magnitude","high"
"33","Hovius N, Stark CP, Tutton MA, Abbott LD","1998","Landslide-driven drainage network evolution in a pre-steady-state mountain belt: Finisterre Mountains, Papua New Guinea","Geology","10.1130/0091-7613(1998)026<1071:LDDNEI>2.3.CO;2","geomorphic_adjustment","coseismic_landslide","field_observation","Finisterre Mountains, Papua New Guinea","drainage density; landslide rate; channel head migration; relief evolution","decades","Earthquake-triggered landslides drive drainage network expansion in rapidly uplifting terrain by creating new channel heads at landslide scars; drainage density increases by 15-30% after large seismic events fundamentally reorganizing the catchment geometry","medium"
"34","Campforts B, Shobe CM, Steer P et al.","2020","HyLands 1.0: a hybrid landscape evolution model to simulate the impact of landslides and landslide-derived sediment on landscape evolution","Geoscientific Model Development","10.5194/gmd-13-3863-2020","multiple","multiple","modeling","Synthetic mountain landscapes","landslide probability; sediment thickness; channel bed evolution; landscape response time","century","HyLands model shows that landslide-derived sediment creates transient fluvial aggradation up to 10x background that takes 10-100x longer to evacuate than the interseismic period; neglecting landslide sediment in landscape evolution models underestimates valley fill thickness by 50-80%","high"
"35","Hovius N, Meunier P, Lin CW et al.","2020","Earthquake statistics changed by typhoon-driven erosion","Scientific Reports","10.1038/s41598-020-67865-y","recovery","hydrometeorological","combined","Taiwan","seismicity rate; erosion volume; Coulomb stress; typhoon rainfall","years","Typhoon Morakot removed ~1.2 km3 of material from southern Taiwan in 2009 causing a measurable decrease in shallow seismicity rates in the following 2 years; this demonstrates a direct coupling where surface erosion modulates crustal stress and earthquake occurrence","medium"
"36","Izumiyama H, Uchida T, Horie K, Sakurai W","2020","Characteristics of sediment dynamics following large-scale sediment supply events in mountain watersheds in Japan","Geomorphology","10.1016/j.geomorph.2020.107301","remobilization","debris_flow","field_observation","Mountain watersheds, Japan","sediment yield; debris flow volume; channel storage; event magnitude","decades","Japanese mountain watersheds show a characteristic two-phase sediment response: initial 3-5 year pulse of debris flows mobilizing channel-stored material followed by a 10-30 year tail of elevated fluvial transport; total evacuation efficiency ranges from 20-60% depending on catchment gradient and rainfall regime","high"
"37","Kincey ME, Rosser NJ, Robinson TR et al.","2021","Evolution of Coseismic and Post-seismic Landsliding After the 2015 Mw 7.8 Gorkha Earthquake, Nepal","Journal of Geophysical Research: Earth Surface","10.1029/2020JF005803","remobilization","coseismic_landslide","remote_sensing","Nepal","landslide count; new vs reactivated ratio; NDVI recovery; monsoon correlation","years","Post-Gorkha landslide rates remained 3-5x above pre-earthquake background for at least 5 years; 60% of post-seismic landslides were reactivations of coseismic scars rather than new failures indicating persistent slope damage controls the post-seismic hazard trajectory","high"
"38","Croissant T, Hilton RG, Li GK et al.","2021","Pulsed carbon export from mountains by earthquake-triggered landslides explored in a reduced-complexity model","Earth Surface Dynamics","10.5194/esurf-9-823-2021","remobilization","hillslope_connectivity","modeling","Synthetic mountain catchments","organic carbon flux; landslide-derived POC; oxidation rate; fluvial transport time","decades","Over 90% of landslide-mobilized particulate organic carbon is exported from mountain catchments within 1-2 seismic cycles; rapid fluvial evacuation limits in-transit oxidation meaning earthquakes create pulsed carbon transfers from rock to ocean on decadal timescales","medium"
"39","Tanyaş H, Kirschbaum D, Görüm T et al.","2021","A closer look at factors governing landslide recovery time in post-seismic periods","Engineering Geology","10.1016/j.enggeo.2021.106333","recovery","coseismic_landslide","combined","Global (multiple post-seismic sites)","landslide recovery time; NDVI; rainfall; earthquake magnitude; lithology","decades","Landslide recovery time shows a non-linear dependence on earthquake magnitude with Mw7+ events requiring 5-10 years for landslide rates to return to background; wet tropical climates recover 2-3x faster than arid regions due to accelerated vegetation regrowth and sediment flushing","high"
"40","Xu Q, Li WL, Dong XJ et al.","2021","Catastrophic debris flows triggered by the 20 August 2019 rainfall, a decade since the Wenchuan earthquake, China","Landslides","10.1007/s10346-021-01697-1","remobilization","debris_flow","field_observation","Wenchuan, China","debris flow volume; rainfall intensity-duration; source material; fatalities","decades","Catastrophic debris flows in 2019 (11 years post-earthquake) killed 13 people showing coseismic sediment legacy persists beyond expected recovery; the debris flows sourced from reactivated coseismic landslide deposits suggesting that single extreme rainfall events can reset the sediment evacuation clock","high"
"41","Francis OR, Fan XM, Hales TC et al.","2022","The Fate of Sediment After a Large Earthquake","Journal of Geophysical Research: Earth Surface","10.1029/2021JF006544","multiple","multiple","modeling","Wenchuan, China","sediment cascade model; landslide-to-channel transfer; debris flow initiation; fluvial export","decades","A sediment cascade model for Wenchuan shows that only 5-15% of coseismic landslide volume reaches the main river within the first decade; debris flows are the primary transfer mechanism in steep tributaries while fluvial transport dominates in mainstem channels creating a spatially variable evacuation pattern","high"
