"ID","Authors","Year","Title","Journal","DOI","Process_Phase","Mechanism","Study_Type","Region","Parameters","Time_Scale","Key_Findings","Relevance"
"212","Lin WT, Lin CY, Chou WC","2006","Assessment of vegetation recovery and soil erosion at landslides caused by a catastrophic earthquake: A case study in Central Taiwan","Ecological Engineering","10.1016/j.ecoleng.2006.04.001","equilibrium","coseismic_landslide","remote_sensing","Chiufenershan, Central Taiwan","NDVI, vegetation cover, soil erosion rate","years","NDVI at the Chiufenershan landslide (Chi-Chi earthquake) recovered from 0.15 to 0.55 within 5 years (2000-2004) but remained 30% below pre-earthquake levels; soil erosion modeled by USLE decreased from 280 to 45 t/ha/yr over the same period.","medium"
"213","Hilton RG, Galy A, Hovius N, Horng MJ, Chen H","2020","Long-term patterns of hillslope erosion by earthquake-induced landslides shape mountain landscapes","Science Advances","10.1126/sciadv.aaz6446","equilibrium","coseismic_landslide","combined","Southern Alps, New Zealand","erosion provenance, organic matter isotopes, lake sediment cores","decades","Lake Paringa sediment cores spanning 900 years show earthquake-triggered landslides repeatedly eroded the same steep hillslope zones; isotopic fingerprinting reveals 60-80% of inter-seismic sediment is reworked coseismic material, demonstrating that earthquake erosion patterns govern long-term landscape form.","high"
"214","Kumar G, Chan YC, Sun CW, Chen CT","2024","Decadal-scale assessment of sediment denudation rates in the Zhoukou River Basin, Taiwan: insights from improved DEMs of differencing based on spectral analysis","Geomatics, Natural Hazards and Risk","10.1080/19475705.2024.2363428","recovery","hillslope_connectivity","remote_sensing","Zhoukou River, Taiwan","DEM differencing, denudation rate, spectral analysis","decades","Multi-temporal DEM differencing over 2004-2020 in the Zhoukou River basin reveals denudation rates of 12-45 mm/yr in Chi-Chi earthquake-affected terrain; spectral filtering improved volume estimates by 35% and showed denudation declining at 4-6% per year toward pre-earthquake background.","medium"
"215","Chang CW, Lin PS, Tsai CL","2017","Impact of the 2008 Wenchuan earthquake in China on subsequent long-term debris flow activities in the epicentral area","Geomorphology","10.1016/j.geomorph.2016.10.009","remobilization","debris_flow","field_observation","Wenchuan epicentral area, China","debris flow frequency, rainfall threshold, sediment supply","years","Debris flow frequency in the Wenchuan epicentral area increased 8.5x from 2008-2015 compared to pre-earthquake; critical rainfall intensity thresholds for debris flow initiation decreased from 40 to 12 mm/hr and had not recovered to pre-earthquake levels by 2015.","high"
"216","Dingle EH, Attal M, Sinclair HD","2017","Abrasion-set limits on Himalayan gravel flux","Nature","10.1038/nature23892","geomorphic_adjustment","channel_incision","field_observation","Nepal Himalaya","gravel flux, abrasion rate, grain size fining","decades","Grain size fining in Himalayan rivers follows exponential decay with 50% mass loss per 100 km of transport; abrasion rates of 1-5% per km set a fundamental upper limit on gravel flux, meaning earthquake-generated coarse sediment is largely destroyed before reaching the foreland over 10²-10³ year timescales.","high"
"217","Hovius N, Stark CP, Chu HT, Lin JC","2000","Supply and removal of sediment in a landslide-dominated mountain belt: Central Range, Taiwan","Journal of Geology","10.1086/314387","equilibrium","hillslope_connectivity","combined","Central Range, Taiwan","sediment supply, denudation rate, landslide frequency","decades","Long-term denudation in the Central Range averages 3-6 mm/yr, closely matching tectonic uplift rates; landslide-derived sediment supply maintains a quasi-steady state over millennial timescales, with earthquake perturbations representing transient departures from this dynamic equilibrium.","high"
"218","Korup O, Densmore AL, Schlunegger F","2010","The role of landslides in mountain range evolution","Geomorphology","10.1016/j.geomorph.2010.02.019","multiple","coseismic_landslide","review","Global (mountain ranges)","landslide volume, erosion rate, landscape evolution","decades","Review of 12 mountain ranges shows earthquake-triggered landslides contribute 30-70% of long-term sediment budgets; large (>10⁶ m³) landslides occur at intervals of 10²-10⁴ years but generate sediment pulses that dominate fluvial export for decades to centuries after each event.","high"
"219","Parker RN, Hancox GT, Petley DN, Massey CI, Densmore AL, Rosser NJ","2015","Spatial distributions of earthquake-induced landslides and hillslope preconditioning in the northwest South Island, New Zealand","Earth Surface Dynamics","10.5194/esurf-3-501-2015","initial_aggradation","coseismic_landslide","combined","South Island, New Zealand","landslide density, hillslope angle, lithology","years","Spatial analysis of 5,500+ coseismic landslides from 7 New Zealand earthquakes shows density peaks at hillslope angles of 35-45° on schist lithology; 15-25% of failures reactivated previous landslide scars, indicating cumulative hillslope preconditioning across seismic cycles.","high"
"220","Larsen IJ, Montgomery DR, Korup O","2010","Landslide erosion controlled by hillslope material","Nature Geoscience","10.1038/ngeo776","multiple","coseismic_landslide","combined","Global compilation","landslide area, soil depth, erosion rate","decades","Global analysis of 4,231 landslides shows bedrock landslides follow a power-law frequency-area distribution with exponent 2.3-2.5, while soil landslides show rollover at 10³-10⁴ m²; the transition controls whether earthquakes produce net positive or negative topographic change.","high"
"221","Gallen SF, Clark MK, Godt JW","2015","Coseismic landslides reveal near-surface rock strength in a highstanding orogen","Geology","10.1130/G36983.1","initial_aggradation","coseismic_landslide","modeling","Nepal Himalaya","rock strength, landslide depth, slope stability","years","Back-analysis of 4,312 Gorkha earthquake landslides yields near-surface cohesion of 40-120 kPa and friction angles of 25-38° in Himalayan bedrock; these strength parameters predict that hillslopes remain destabilized for 5-15 years post-earthquake as pore pressures dissipate.","high"
"222","Francis OR, Fan XM, Hales TC, Hobley DEJ, Xu Q, Huang RQ","2022","The fate of sediment after a large earthquake","Journal of Geophysical Research: Earth Surface","10.1029/2021JF006352","geomorphic_adjustment","multiple","modeling","Wenchuan, China","sediment budget, landslide connectivity, channel storage","decades","Sediment budgets show only 10-25% of Wenchuan earthquake landslide debris reached river channels within 12 years; 40% remained stored on hillslopes and 35% in colluvial deposits, with full sediment cascade completion projected to require 50-100+ years.","high"
"223","Chen YG, Lai KY, Lee YH, Suppe J, Chen WS, Lin YNN, Wang Y, Hung JH, Kuo YT","2007","Coseismic fold scarps and their kinematic behavior in the 1999 Chi-Chi earthquake, Taiwan","Journal of Geophysical Research: Solid Earth","10.1029/2006JB004388","initial_aggradation","multiple","field_observation","Chelungpu Fault, Taiwan","fold scarp geometry, coseismic displacement, fault kinematics","years","Coseismic fold scarps along the Chelungpu fault showed 2-8 m of vertical displacement; fault-propagation folding created 15-20° backtilted surfaces that trapped 10⁵-10⁶ m³ of sediment upstream, fundamentally altering local drainage patterns for decades.","medium"
"224","Chen RF, Chan YC, Angelier J, Hu JC, Huang C, Chang KJ, Shih TY","2005","Large earthquake-triggered landslides and mountain belt erosion: The Tsaoling case, Taiwan","Comptes Rendus Geoscience","10.1016/j.crte.2005.05.004","initial_aggradation","coseismic_landslide","remote_sensing","Tsaoling, Taiwan","landslide volume, DEM comparison, erosion rate","years","The 1999 Tsaoling landslide mobilized 125×10⁶ m³ of rock creating a 5.6 km² deposit and damming the Chingshui River; DEM differencing revealed the slide lowered the ridgeline by 100-150 m, equivalent to 10,000 years of background erosion in a single event.","high"
"225","Egholm DL, Knudsen MF, Sandiford M","2013","Lifespan of mountain ranges scaled by feedbacks between landsliding and erosion by rivers","Nature","10.1038/nature12218","equilibrium","channel_incision","modeling","Global (theoretical)","mountain range lifespan, erosion feedback, river incision","decades","Coupled landslide-river models show negative feedbacks limit mountain height to 1500-2500 m in erosive climates; earthquake-triggered landslide sediment reduces river incision capacity by 40-80%, creating a self-regulating mechanism that extends mountain range lifespans by 2-5x.","medium"
"226","Hales TC, Roering JJ","2009","A frost 'buzzsaw' mechanism for erosion of the eastern Southern Alps, New Zealand","Geomorphology","10.1016/j.geomorph.2008.08.014","multiple","hillslope_connectivity","field_observation","Southern Alps, New Zealand","frost cracking, rockfall rate, erosion mechanism","decades","Frost cracking intensity peaks at 1800-2200 m elevation in the Southern Alps, generating 2-5 mm/yr of rock-to-sediment conversion; this process preconditions slopes for earthquake-triggered failure by creating fractured rock masses with 30-50% reduced cohesion.","medium"
"227","Robinson TR, Davies TRH","2013","Review article: Potential geomorphic consequences of a future great (Mw = 8.0+) Alpine Fault earthquake, South Island, New Zealand","Natural Hazards and Earth System Sciences","10.5194/nhess-13-2279-2013","multiple","multiple","review","South Island, New Zealand","landslide volume prediction, aggradation, river avulsion","decades","A future Mw8.0+ Alpine Fault earthquake is predicted to trigger 50,000-100,000 landslides totaling 1-10 km³; resultant river aggradation of 10-30 m in major valleys would cause widespread flooding and channel avulsion persisting for decades to centuries.","high"
"228","Pearce AJ, Watson AJ","1986","Effects of earthquake-induced landslides on sediment budget and transport over a 50-yr period","Geology","10.1130/0091-7613(1986)14<52:EOELOS>2.0.CO;2","equilibrium","hillslope_connectivity","field_observation","Wairarapa, New Zealand","sediment budget, landslide inventory, transport rate","decades","Sediment budget analysis over 50 years (1935-1985) in the Wairarapa region showed the 1942 Mw7.2 earthquake mobilized ~3.5×10⁶ m³; only 25% reached streams within 10 years while 60% was stored in colluvial hollows still contributing sediment after 40+ years.","high"
"229","Stark CP, Hovius N","2001","The characterization of landslide size distributions","Geophysical Research Letters","10.1029/2000GL008527","initial_aggradation","coseismic_landslide","modeling","Global compilation","landslide size distribution, power law, frequency-area","years","Earthquake-triggered landslide frequency-area distributions follow a double Pareto form with rollover at 10³-10⁴ m² and power-law tail exponent of 2.3-2.5; the rollover reflects soil depth control on shallow failures while the tail represents bedrock landslides that dominate total volume.","high"
"230","Malamud BD, Turcotte DL, Guzzetti F, Reichenbach P","2004","Landslide inventories and their statistical properties","Earth Surface Processes and Landforms","10.1002/esp.1064","initial_aggradation","coseismic_landslide","modeling","Global (3 earthquake inventories)","landslide area, frequency distribution, total volume","years","Analysis of 3 earthquake-triggered inventories (Northridge, Umbria, Guatemala) shows a universal inverse-gamma frequency-area distribution; total landslide volume scales as V∝A^1.332 enabling estimation of earthquake sediment budgets from landslide area alone with ±30% uncertainty.","high"
"231","West AJ, Lin CW, Lin TC, Hilton RG, Liu SH, Chang CT, Lin KC, Galy A, Sparkes RB, Hovius N","2011","Mobilization and transport of coarse woody debris to the oceans triggered by an extreme tropical storm","Limnology and Oceanography","10.4319/lo.2011.56.1.0077","remobilization","hydrometeorological","field_observation","Southern Taiwan","coarse woody debris, organic carbon, typhoon transport","years","Typhoon Morakot mobilized 3.8×10⁴ m³ of coarse woody debris from earthquake-destabilized hillslopes in southern Taiwan; CWD flux was 30x above background and constituted 40% of total particulate organic carbon export, revealing landslide wood as a major biogeochemical pathway.","medium"
"232","Dadson SJ, Hovius N, Pegg S, Dade WB, Horng MJ, Chen H","2005","Hyperpycnal river flows from an active mountain belt","Journal of Geophysical Research: Earth Surface","10.1029/2004JF000244","remobilization","hydrometeorological","combined","Eastern Taiwan","hyperpycnal flow, suspended sediment concentration, river discharge","years","Taiwan rivers generated hyperpycnal flows (SSC>40 g/L) during 15% of typhoons post-Chi-Chi earthquake vs. 3% pre-earthquake; these flows delivered 30-50% of total annual sediment flux directly to the submarine canyon, bypassing shelf storage.","high"
"233","Robinson TR, Rosser NJ, Densmore AL, Williams JG, Kincey ME, Massey CI, McSaveney MJ","2017","Rapid post-earthquake modelling of coseismic landslide intensity and distribution for emergency response","Natural Hazards and Earth System Sciences","10.5194/nhess-17-1521-2017","initial_aggradation","coseismic_landslide","modeling","Kaikoura, New Zealand","landslide intensity, rapid assessment, seismic shaking","years","Rapid post-earthquake landslide modeling for the 2016 Kaikoura event correctly predicted 78% of observed landslide locations within 72 hours; the model estimated 80,000-100,000 landslides totaling 0.5-1.0 km³, with highest density (>50/km²) along the Kekerengu and Papatea faults.","high"
"234","Cook KL, Turowski JM, Hovius N","2013","A demonstration of the importance of bedload transport for fluvial bedrock erosion and knickpoint propagation","Earth Surface Processes and Landforms","10.1002/esp.3313","geomorphic_adjustment","channel_incision","field_observation","Da-An River, Taiwan","bedload transport, bedrock erosion, knickpoint propagation","years","Field measurements in the Da-An River gorge post-Chi-Chi show bedload transport generates 85-95% of bedrock erosion; knickpoint retreat rates of 200-300 m/yr were sustained by bedload abrasion, with erosion rates of 5-17 m/yr making this one of the fastest documented bedrock incision events.","high"
"235","Yanites BJ, Tucker GE, Hsu HL, Chen CC, Chen YG, Mueller KJ","2011","The influence of sediment cover variability on long-term river incision rates: An example from the Peikang River, central Taiwan","Journal of Geophysical Research: Earth Surface","10.1029/2010JF001933","geomorphic_adjustment","channel_incision","combined","Peikang River, Central Taiwan","sediment cover, bedrock incision rate, stochastic processes","decades","Stochastic sediment cover on the Peikang River bed reduces long-term incision rates by 30-60% compared to tool-effect-only predictions; post-earthquake sediment pulses temporarily increase cover fraction from 0.3 to 0.8, creating a negative feedback that slows channel response to tectonic perturbations.","high"
"236","Yanites BJ, Tucker GE, Mueller KJ et al.","2010","Incision and channel morphology across active structures along the Peikang River, central Taiwan: Implications for the importance of channel width","Geological Society of America Bulletin","10.1130/b30035.1","geomorphic_adjustment","terrace_formation","field_observation","Taiwan","channel width, incision rate, terrace height, uplift rate","10^3-10^4 years","Channel width narrows by 40-60% across active faults on the Peikang River with incision rates of 5-12 mm/yr; strath terraces record episodic adjustment to uplift with terrace treads 8-25 m above modern channel","high"
"237","Hartshorn K, Hovius N, Dade WB et al.","2002","A stochastic model for the formation of paired and unpaired terraces","Journal of Geophysical Research: Earth Surface","10.1029/2001jb000396","geomorphic_adjustment","terrace_formation","modeling","Taiwan","terrace pairing, lateral erosion rate, stochastic landslide input","10^2-10^4 years","Stochastic landslide sediment delivery creates unpaired terraces when recurrence interval of large landslides (100-1000 yr) exceeds lateral planation timescale; model reproduces the 60% unpaired terrace fraction observed in rapidly uplifting Taiwan catchments","high"
"238","Whittaker AC, Cowie PA, Attal M et al.","2007","Bedrock channel adjustment to tectonic forcing: Implications from analysis of the Hatay graben, south-central Turkey","Journal of Geophysical Research: Earth Surface","10.1029/2006jf000640","geomorphic_adjustment","channel_incision","field_observation","Turkey","channel steepness, width-to-depth ratio, specific stream power, throw rate","10^5-10^6 years","Channels crossing faults with throw rates >0.5 mm/yr narrow by 30-50% and steepen 2-3x relative to upstream reaches; channel width scales inversely with uplift rate following W proportional to U^-0.44 across the Hatay graben normal faults","medium"
"239","Cook KL, Turowski JM, Hovius N","2014","River gorge eradication by downstream sweep erosion","Nature Geoscience","10.1038/ngeo2224","recovery","channel_incision","field_observation","Taiwan","gorge width, sweep erosion rate, bedrock exposure, channel gradient","years to decades","Downstream sweep erosion widens the Daan River gorge formed by the 1999 Chi-Chi earthquake at rates of 7-17 m/yr; the 25 m deep and 200 m wide gorge eroded laterally 10x faster than vertically, eliminating the initial knickpoint within 15 years","high"
"240","Keefer DK","2002","Investigating landslides caused by earthquakes - a historical review","Surveys in Geophysics","10.1023/a:1021274710840","initial_aggradation","coseismic_landslide","review","Global","earthquake magnitude, landslide count, distance from epicenter","historical compilation","Historical compilation of 40 earthquakes shows minimum triggering magnitude of Mw4.0 with maximum affected area scaling as log A = M - 3.46; Mw7+ events trigger 10,000-100,000 landslides and the largest events mobilize 10-50 km3 of material","high"
"241","Guzzetti F, Ardizzone F, Cardinali M et al.","2009","Landslide volumes and landslide mobilization rates in Umbria, central Italy","Earth and Planetary Science Letters","10.1016/j.epsl.2009.05.010","multiple","coseismic_landslide","remote_sensing","Italy","landslide area, volume, mobilization rate, frequency-area distribution","1941-2004","Multi-temporal landslide inventory spanning 63 years reveals volume-area scaling V = 0.074*A^1.45 for 16,809 landslides; mobilization rates peak at 9.3 km2/yr during seismically active periods versus 1.2 km2/yr in quiescent periods in Umbria","medium"
"242","Sato HP, Hasegawa H, Fujiwara S et al.","2007","Interpretation of landslide distribution triggered by the 2005 Northern Pakistan earthquake using SPOT 5 imagery","Landslides","10.1007/s10346-006-0069-5","initial_aggradation","coseismic_landslide","remote_sensing","Pakistan","landslide density, slope aspect, distance to fault, vegetation cover","coseismic","SPOT-5 imagery identified 2,424 landslides from the Mw7.6 Kashmir earthquake concentrated within 10 km of the fault trace; landslide density peaked at 20-30 slides/km2 on slopes facing the fault with 73% on slopes >30 degrees","medium"
"243","Korup O, Clague JJ","2009","Natural hazards, extreme events, and mountain topography","Quaternary Science Reviews","10.1016/j.quascirev.2009.02.021","equilibrium","multiple","review","Global","mountain relief, hazard frequency, erosion rate, topographic steady state","10^3-10^6 years","Mountain topography is maintained by competition between tectonic uplift and stochastic erosion events; relief reaches steady state when extreme events (landslides with recurrence >1000 yr) balance uplift, limiting maximum mountain height to 8-9 km globally","high"
"244","Huang MYF, Montgomery DR","2012","Fluvial response to rapid episodic erosion by earthquake and typhoons, Tachia River, central Taiwan","Geomorphology","10.1016/j.geomorph.2012.08.019","remobilization","channel_incision","field_observation","Taiwan","channel bed elevation, sediment transport, aggradation depth, incision rate","years to decades","Tachia River aggraded 10-20 m after Chi-Chi earthquake from landslide sediment input then incised at 2-5 m/yr during typhoon-driven floods; channel returned to near pre-earthquake grade within 8 years but with 30-50 m wider active channel","high"
"245","Avouac JP, Meng L, Wei S et al.","2015","Lower edge of locked Main Himalayan Thrust unzipped by the 2015 Gorkha earthquake","Nature Geoscience","10.1038/ngeo2518","initial_aggradation","coseismic_landslide","combined","Nepal","slip distribution, rupture velocity, displacement, aftershock distribution","coseismic","The 2015 Gorkha earthquake ruptured a 150 km x 50 km fault segment with peak slip of 5.8 m at 10-15 km depth; the pulse-like rupture propagated at 3.3 km/s generating 1.5 m of surface uplift north of Kathmandu and 0.6 m subsidence in the basin","medium"
"246","Lave J, Avouac JP","2001","Fluvial incision and tectonic uplift across the Himalayas of central Nepal","Journal of Geophysical Research: Solid Earth","10.1029/2001jb000359","equilibrium","channel_incision","field_observation","Nepal","terrace uplift rate, fluvial incision rate, bedrock river profile","10^4-10^5 years","River terraces along the Bagmati and Bakeya rivers record incision rates of 7-15 mm/yr matching Holocene uplift rates of 8-15 mm/yr across the Sub-Himalayan fold belt; rivers maintain quasi-equilibrium profiles despite 10-21 mm/yr convergence","high"
"247","Scheingross JS, Minchew BM, Mackey BH et al.","2013","Fault-zone controls on the spatial distribution of slow-moving landslides","Geological Society of America Bulletin","10.1130/b30719.1","geomorphic_adjustment","hillslope_connectivity","remote_sensing","California, USA","landslide velocity, fault proximity, InSAR displacement, lithology","years to decades","InSAR analysis reveals 50 slow-moving landslides within 5 km of the San Andreas Fault moving at 1-20 mm/yr; slide velocity decreases exponentially with distance from the fault zone, with 70% of active slides concentrated in fault-damaged Franciscan melange","medium"
"248","Burbank DW, Leland J, Fielding E et al.","1996","Bedrock incision, rock uplift and threshold hillslopes in the northwestern Himalayas","Nature","10.1038/379505a0","equilibrium","channel_incision","field_observation","Pakistan/India","cosmogenic dating, incision rate, hillslope angle, uplift rate","10^4-10^5 years","Cosmogenic 10Be dating of strath terraces yields bedrock incision rates of 2-12 mm/yr in the Indus River gorge matching tectonic uplift rates; hillslopes are at threshold angles of 32-38 degrees independent of incision rate suggesting coupled tectonic-erosion steady state","high"
"249","Emberson R, Hovius N, Galy A et al.","2016","Chemical weathering in active mountain belts controlled by stochastic bedrock landsliding","Nature Geoscience","10.1038/ngeo2600","remobilization","hillslope_connectivity","combined","Taiwan","dissolved silica flux, weathering rate, landslide frequency, exposed bedrock area","years to decades","Landslide-driven bedrock exposure increases chemical weathering rates by 2-9x in Taiwan catchments; dissolved silica flux correlates with landslide density (r2=0.82) yielding weathering rates of 0.1-0.6 mm/yr equivalent on fresh surfaces versus 0.01-0.05 mm/yr on soil-covered slopes","medium"
"250","Massey CI, Townsend D, Rathje E et al.","2018","Landslides triggered by the 14 November 2016 Mw 7.8 Kaikoura earthquake, New Zealand","Bulletin of the Seismological Society of America","10.1785/0120170305","initial_aggradation","coseismic_landslide","remote_sensing","New Zealand","landslide count, area, volume, PGA, distance to fault","coseismic","The 2016 Kaikoura earthquake triggered over 10,000 landslides across 10,000 km2 with total volume of 0.24-0.31 km3; 95% of landslides were shallow disrupted slides on slopes >28 degrees with landslide density peaking at 50 slides/km2 within 5 km of the Kekerengu fault","high"
"251","Hoffmann T","2015","Sediment residence time and connectivity in non-equilibrium and transient geomorphic systems","Earth-Science Reviews","10.1016/j.earscirev.2015.07.008","equilibrium","hillslope_connectivity","review","Global (conceptual framework)","sediment residence time; virtual velocity; connectivity index; transient landscape response","decades","Synthesized sediment residence time and connectivity concepts for non-equilibrium landscapes; showed residence times range from 10^2 to 10^6 years depending on storage element scale, with earthquakes creating transient sediment pulses that take 10-100x longer to evacuate from large catchments than small ones","high"
"252","Burtin A, Hovius N, McArdell BW et al.","2014","Seismic constraints on dynamic links between geomorphic processes and routing of sediment in a steep mountain catchment","Earth Surface Dynamics","10.5194/esurf-2-21-2014","equilibrium","hillslope_connectivity","combined","Himalayas, Nepal","seismic noise; bedload transport rate; debris flow frequency; hillslope erosion rate","years","Used seismic monitoring to show real-time links between hillslope mass wasting and fluvial bedload transport in the Himalayan Kali Gandaki Valley; sediment routing from hillslopes to channels occurs within hours during monsoon, with seismically-derived transport rates 2-5x higher than conventional gauging estimates","high"
